{
  "$schema": "https://json-schema.org/draft/2020-12/schema",
  "$id": "https://github.com/kaileconsulting/trinity-skills/blob/main/iterate-review/reviewer-output.schema.json",
  "title": "iterate-review reviewer output",
  "description": "Structured output from Codex reviewing a code diff via the iterate-review skill. Enforced by codex exec --output-schema. All four top-level array fields are required-but-may-be-empty.",
  "type": "object",
  "additionalProperties": false,
  "required": [
    "verdict",
    "findings",
    "code_corrections",
    "new_questions"
  ],
  "properties": {
    "verdict": {
      "type": "string",
      "enum": ["APPROVE", "REVISE", "BLOCK"],
      "description": "APPROVE = code is structurally sound, ready to ship; REVISE = at least one load-bearing issue to fix; BLOCK = fundamental problem that invalidates the change's premise (rare)."
    },
    "findings": {
      "type": "array",
      "description": "Substantive issues with the code change. Required field; may be empty if verdict=APPROVE with nothing to flag.",
      "items": {
        "type": "object",
        "additionalProperties": false,
        "required": ["title", "severity", "description", "suggested_action"],
        "properties": {
          "title": {
            "type": "string",
            "maxLength": 120,
            "description": "Short identifier for the finding."
          },
          "severity": {
            "type": "string",
            "enum": ["HIGH", "MEDIUM", "LOW"],
            "description": "HIGH = load-bearing, would cause incorrect behavior or break invariants if shipped; always blocks APPROVE. MEDIUM = real issue worth addressing; doesn't block APPROVE if the editor disputes/explains, but considered. LOW = nit, polish, stylistic."
          },
          "description": {
            "type": "string",
            "minLength": 1,
            "description": "Full text of the issue. Cite file paths and line numbers from the diff when useful (e.g., 'web/lib/foo.ts:42 introduces an unguarded null deref'). Be concrete."
          },
          "suggested_action": {
            "type": "string",
            "minLength": 1,
            "description": "What the editor should consider doing about it. May be open-ended ('clarify the contract') or specific ('add a null check before line 42'). Describe intent, not the literal patch text."
          },
          "register_ref": {
            "type": "string",
            "pattern": "^RR-[0-9]{4}-[0-9]{2}-[0-9]{2}-[a-z0-9]+(-[a-z0-9]+)*$",
            "description": "OPTIONAL. Set only when this finding is independently actionable AND its behavior falls within a specific entry's recorded bound/recovery in the accepted-risks register (docs/risk-posture.md, provided in the RISK POSTURE block when present). Do not set this to merely reference a posture decision — if a finding only restates something the register or posture already covers with no new evidence, don't file it at all. Do not set this if you are presenting evidence that the entry's bound or recovery path is false — that is a fresh finding, not a match, even if it concerns the same behavior. The editor validates every register_ref against the current register at fold time; an unknown, malformed, or non-matching ref is treated as untagged."
          }
        }
      }
    },
    "code_corrections": {
      "type": "array",
      "description": "Tactical non-controversial fixes (typos in comments, broken imports, dead code, contradictions between docstring and behavior). Required; may be empty. Distinct from findings in that corrections are mechanical and the editor should incorporate them without dispute.",
      "items": {
        "type": "object",
        "additionalProperties": false,
        "required": ["location", "issue", "fix"],
        "properties": {
          "location": {
            "type": "string",
            "minLength": 1,
            "description": "File path with line number when known (e.g., 'web/app/page.tsx:120', 'pipeline/foo.py:fn_name'). For changes spanning multiple lines, use a range or the function/section name."
          },
          "issue": {
            "type": "string",
            "minLength": 1,
            "description": "What's wrong."
          },
          "fix": {
            "type": "string",
            "minLength": 1,
            "description": "What it should be, in abstract terms. The editor does the actual edit."
          }
        }
      }
    },
    "new_questions": {
      "type": "array",
      "description": "Questions you want answered in the next pass — typically clarifications about author intent or constraints not visible in the diff — each classified by WHO CAN SETTLE IT. Required; may be empty. If you can answer a question yourself from the diff and intent you were given, say so in a finding instead of filing it here.",
      "items": {
        "type": "object",
        "additionalProperties": false,
        "required": ["question", "settled_by", "why"],
        "properties": {
          "question": {
            "type": "string",
            "minLength": 1,
            "description": "The question itself."
          },
          "settled_by": {
            "type": "string",
            "enum": ["resolvable_in_fold", "needs_lookup", "needs_human"],
            "description": "Who can settle this. 'resolvable_in_fold' = answerable from the repository the diff came from — you see only the diff, so the editor can read the surrounding code, callers, and tests you cannot. 'needs_lookup' = a fact exists that settles it, but reaching that fact requires something you cannot do (a network call, an API query, running the test suite or a benchmark). 'needs_human' = no fact and no derivation settles it; it needs the author's intent, risk tolerance, cost appetite, or product judgment. WHEN UNSURE, CHOOSE 'needs_human' — wrongly labelling an author's decision as machine-resolvable invites a fabricated answer, which is far worse than an unnecessary escalation."
          },
          "why": {
            "type": "string",
            "minLength": 1,
            "description": "One line justifying the classification — e.g. which file you'd need to read, what lookup would settle it, or which judgment only the author can make. This exists so the label can be audited rather than trusted; a bare enum is easy to rubber-stamp."
          }
        }
      }
    }
  }
}
